{
  "apis": [
    {
      "contracts": [
        {
          "basePath": "/api/v1",
          "default": false,
          "digest": "sha256:7c02aa11bb22cc33dd44ee55ff66778899aabbccddeeff00112233445566778",
          "format": "swagger-2.0",
          "version": "1.0"
        },
        {
          "basePath": "/api/v2",
          "default": true,
          "digest": "sha256:55de0011223344556677889900aabbccddeeff00112233445566778899aabbcc",
          "format": "openapi-3.1",
          "version": "2.0"
        }
      ],
      "detect": {
        "method": "GET",
        "path": "/version",
        "pattern": "^(\\d+\\.\\d+)"
      },
      "downstreamAuth": {
        "apiKey": {
          "in": "header",
          "name": "X-Api-Key"
        },
        "identity": "service-account",
        "supported": [
          "basic",
          "apiKey",
          "oauth2ClientCredentials",
          "mtls"
        ],
        "unsatisfiedTools": "hide"
      },
      "id": "orders",
      "pagination": null,
      "requestBody": {
        "multiple": "split",
        "suffixes": {
          "application/octet-stream": "binary",
          "application/x-www-form-urlencoded": "form",
          "multipart/form-data": "multipart"
        }
      },
      "title": "Example Orders API",
      "toolPrefix": "orders"
    }
  ],
  "build": {
    "cli": "0.4.2",
    "createdAt": "2026-10-09T10:40:00Z",
    "definition": {
      "digest": "sha256:4be0c1d27f6a9e3b5c8d0e1f2a3b4c5d6e7f8091a2b3c4d5e6f708192a3b91d2",
      "name": "orders-mcp",
      "source": "git+https://git.acme.internal/integration/mcp-defs.git#9c41e7a"
    },
    "extends": null,
    "lock": {
      "digest": "sha256:d0c9a1b2c3d4e5f60718293a4b5c6d7e8f9011223344556677889900aabbccdd"
    }
  },
  "diagnostics": [
    {
      "code": "RULE_MATCHES_NOTHING",
      "level": "warning",
      "location": {
        "file": "overrides/10-customers.yaml",
        "line": 14
      },
      "message": "Rule matches no operation in contract 1.0"
    },
    {
      "code": "OPERATION_EXCLUDED",
      "level": "info",
      "operation": "orders:DELETE:/customers/{id}",
      "reason": "access: read-write"
    }
  ],
  "exposure": {
    "mode": "hybrid",
    "pinned": [
      "orders_customer_get",
      "orders_customer_create_multipart"
    ],
    "plainSearch": false
  },
  "instances": {
    "max": null,
    "mixedContracts": "union",
    "mode": "multi"
  },
  "manifestVersion": "1.0",
  "packs": [
    {
      "id": "recording",
      "requires": {
        "config": false
      },
      "tools": [
        "orders_recording_start"
      ],
      "version": "1"
    },
    {
      "id": "issue-tracker",
      "requires": {
        "config": true,
        "configSchema": "#/packs/issue-tracker/config"
      },
      "tools": [],
      "version": "1"
    }
  ],
  "policies": {
    "baseUrlAllowlist": [],
    "confirmDestructive": true,
    "files": {
      "forms": [
        "base64",
        "path"
      ]
    },
    "redaction": {
      "fields": [
        "password",
        "secret",
        "token",
        "apiKey",
        "paymentToken"
      ]
    },
    "responseLimitKb": 256,
    "runtimeDefaults": {
      "audit": {
        "arguments": "redacted",
        "file": {
          "enabled": true,
          "retainDays": 30,
          "rotate": "daily"
        }
      },
      "telemetry": {
        "enabled": false
      },
      "timeouts": {
        "defaultSeconds": 30,
        "maxSeconds": 120
      }
    }
  },
  "runtime": {
    "inboundAuth": {
      "allowed": [
        "none",
        "static",
        "oauth"
      ],
      "default": "none"
    },
    "mcpRevisions": [
      "2025-03-26",
      "2025-06-18",
      "2025-11-25"
    ],
    "minRuntime": "0.4.0",
    "transports": {
      "allowed": [
        "stdio",
        "http"
      ],
      "default": "stdio"
    }
  },
  "schemas": {
    "orders@1.0": {
      "Customer": {
        "properties": {
          "email": {
            "type": "string"
          },
          "id": {
            "type": "string"
          },
          "name": {
            "type": "string"
          }
        },
        "type": "object"
      }
    },
    "orders@2.0": {
      "Customer": {
        "properties": {
          "accountId": {
            "type": "string"
          },
          "createdAt": {
            "format": "date-time",
            "type": "string"
          },
          "email": {
            "type": "string"
          },
          "id": {
            "type": "string"
          },
          "name": {
            "type": "string"
          }
        },
        "type": "object"
      },
      "CustomerUpload": {
        "properties": {
          "document": {
            "format": "binary",
            "type": "string"
          },
          "payload": {
            "type": "object"
          }
        },
        "required": [
          "payload"
        ],
        "type": "object"
      }
    }
  },
  "server": {
    "instructions": "Look up and manage customers, accounts, orders and invoices in the Example Orders API. Every tool requires `instance`; call orders_instances_list to see the configured servers.",
    "name": "orders-mcp",
    "title": "Example Orders API",
    "version": "2.0.0+3"
  },
  "tools": [
    {
      "annotations": {
        "destructiveHint": false,
        "idempotentHint": false,
        "openWorldHint": true,
        "readOnlyHint": false
      },
      "api": "orders",
      "confirm": false,
      "description": "[Orders] Creates a customer and uploads its documents in one request. The account must exist; call orders_account_list first.",
      "inputSchema": {
        "$defs": {
          "CustomerInput": {
            "additionalProperties": false,
            "properties": {
              "accountId": {
                "description": "Id of the account the customer belongs to.",
                "type": "string"
              },
              "email": {
                "format": "email",
                "type": "string"
              },
              "name": {
                "type": "string"
              }
            },
            "required": [
              "name",
              "accountId"
            ],
            "type": "object"
          }
        },
        "additionalProperties": false,
        "properties": {
          "body": {
            "additionalProperties": false,
            "description": "Request body, sent as multipart/form-data.",
            "properties": {
              "document": {
                "description": "Contract document (PDF).",
                "oneOf": [
                  {
                    "additionalProperties": false,
                    "properties": {
                      "base64": {
                        "type": "string"
                      },
                      "contentType": {
                        "enum": [
                          "application/pdf"
                        ],
                        "type": "string"
                      },
                      "filename": {
                        "type": "string"
                      }
                    },
                    "required": [
                      "base64"
                    ],
                    "type": "object"
                  },
                  {
                    "additionalProperties": false,
                    "properties": {
                      "path": {
                        "type": "string"
                      }
                    },
                    "required": [
                      "path"
                    ],
                    "type": "object"
                  }
                ]
              },
              "payload": {
                "$ref": "#/$defs/CustomerInput",
                "description": "Customer data (sent as an application/json part)."
              }
            },
            "required": [
              "payload"
            ],
            "type": "object"
          },
          "instance": {
            "description": "Target Orders API server. Filled in at startup from the runtime config.",
            "enum": [],
            "type": "string",
            "x-mcpgp-instanceEnum": true
          }
        },
        "required": [
          "instance",
          "body"
        ],
        "type": "object"
      },
      "kind": "api",
      "name": "orders_customer_create_multipart",
      "operation": {
        "key": "orders:POST:/customers",
        "operationId": "createCustomer",
        "tags": [
          "customers"
        ]
      },
      "outputSchema": null,
      "provenance": {
        "description": [
          {
            "file": "contracts/orders-2.0.yaml",
            "pointer": "/paths/~1customers/post/description",
            "step": "spec"
          },
          {
            "file": "overrides/10-customers.yaml",
            "line": 2,
            "op": "prepend",
            "step": "rule"
          },
          {
            "file": "overrides/10-customers.yaml",
            "line": 5,
            "op": "append",
            "step": "rule"
          }
        ],
        "name": [
          {
            "step": "source",
            "value": "createCustomer"
          },
          {
            "step": "shape",
            "value": "customer_create"
          },
          {
            "step": "contentTypeSuffix",
            "value": "customer_create_multipart"
          },
          {
            "step": "namespace",
            "value": "orders_customer_create_multipart"
          },
          {
            "file": "mcp-names.lock",
            "since": "1.3.0",
            "step": "lock"
          }
        ]
      },
      "sensitive": false,
      "title": "Create customer with documents",
      "variants": {
        "2.0": {
          "accept": [
            "application/json",
            "application/problem+json"
          ],
          "body": {